{
  "dataset": "leave.balances",
  "ownerService": "leave-service",
  "domain": "leave",
  "grain": "one row per employee per leave type per balance snapshot date",
  "description": "Current and historical leave balances, the reference case for a dataset-sourced field",
  "tenantScoped": true,
  "status": "published",
  "version": "1.0.0",
  "publishedAt": "2026-01-01T00:00:00Z",
  "maxWindowDays": 366,
  "rowLimit": 1000,
  "aggregates": ["latest", "sum", "avg", "min", "max"],
  "columns": [
    {"name": "employeeId", "type": "string", "filterable": true, "aggregatable": false, "windowable": false, "pii": true, "description": "Subject key"},
    {"name": "leaveType", "type": "enum", "filterable": true, "aggregatable": false, "windowable": false, "pii": false, "values": ["CASUAL", "ANNUAL", "SICK", "UNPAID"]},
    {"name": "balanceDays", "type": "decimal", "filterable": false, "aggregatable": true, "windowable": false, "pii": false},
    {"name": "asOfDate", "type": "date", "filterable": true, "aggregatable": false, "windowable": true, "pii": false}
  ]
}
